{
  "$schema": "https://schemas.pythagoras.local/question-package/1.0.0", "format": "pythagoras.question-package", "schemaVersion": "1.0.0", "contentMode": "question-bank",
  "package": { "id": "01910000-0000-7000-8000-000000000110", "key": "missing-answer", "title": "إجابة مفقودة", "subjectKey": "arabic", "language": "ar", "contentRevision": 1 },
  "taxonomy": [{ "id": "01910000-0000-7000-8000-000000000111", "key": "topic", "label": "موضوع", "kind": "topic", "parentId": null, "order": 1 }],
  "bankBrowse": { "mode": "ALL_PACKAGE_QUESTIONS", "entry": { "key": "all", "label": "الكل", "order": 1 }, "nodes": [] }, "assetsManifest": [],
  "questions": [{ "id": "01910000-0000-7000-8000-000000000112", "order": 1, "primaryVariantId": "01910000-0000-7000-8000-000000000113", "taxonomyAssignments": [{ "taxonomyNodeId": "01910000-0000-7000-8000-000000000111", "role": "PRIMARY" }], "variants": [{ "id": "01910000-0000-7000-8000-000000000113", "order": 1, "content": { "type": "doc", "version": 1, "blocks": [{ "id": "01910000-0000-7000-8000-000000000114", "type": "paragraph", "spans": [{ "text": "سؤال بلا إجابة" }] }] }, "occurrences": [] }] }]
}
