{
  "$schema": "https://schemas.pythagoras.local/question-package/1.0.0",
  "format": "pythagoras.question-package",
  "schemaVersion": "1.0.0",
  "contentMode": "question-bank",
  "package": { "id": "01910000-0000-7000-8000-000000000010", "key": "literature-synthetic", "title": "الأدب — بيانات اصطناعية", "subjectKey": "arabic", "language": "ar-IQ", "contentRevision": 1 },
  "taxonomy": [
    { "id": "01910000-0000-7000-8000-000000000011", "key": "literature", "label": "الأدب", "kind": "section", "parentId": null, "order": 1 }
  ],
  "bankBrowse": { "mode": "ALL_PACKAGE_QUESTIONS", "entry": { "key": "literature", "label": "أسئلة الأدب", "order": 1 }, "nodes": [] },
  "assetsManifest": [],
  "questions": [
    {
      "id": "01910000-0000-7000-8000-000000000012",
      "order": 1,
      "primaryVariantId": "01910000-0000-7000-8000-000000000013",
      "taxonomyAssignments": [{ "taxonomyNodeId": "01910000-0000-7000-8000-000000000011", "role": "PRIMARY" }],
      "variants": [{
        "id": "01910000-0000-7000-8000-000000000013",
        "order": 1,
        "content": { "type": "doc", "version": 1, "blocks": [{ "type": "paragraph", "spans": [{ "text": "سؤال أدبي اصطناعي للاختبار فقط." }] }] },
        "occurrences": [{ "id": "01910000-0000-7000-8000-000000000014", "sourceKind": "other", "rawLabel": "مصدر اصطناعي" }]
      }],
      "sharedAnswer": { "type": "doc", "version": 1, "blocks": [{ "type": "paragraph", "spans": [{ "text": "إجابة اصطناعية." }] }] }
    }
  ]
}
