{
  "$schema": "https://schemas.pythagoras.local/question-package/1.0.0",
  "format": "pythagoras.question-package",
  "schemaVersion": "1.0.0",
  "contentMode": "question-bank",
  "package": { "id": "01910000-0000-7000-8000-000000000001", "key": "minimal-arabic", "title": "حزمة تجريبية مصغرة", "subjectKey": "arabic", "language": "ar-IQ", "contentRevision": 1 },
  "taxonomy": [],
  "bankBrowse": { "mode": "ALL_PACKAGE_QUESTIONS", "entry": { "key": "all", "label": "جميع الأسئلة", "order": 1 }, "nodes": [] },
  "assetsManifest": [],
  "questions": []
}
