{
  "$schema": "https://schemas.pythagoras.local/question-package/1.0.0",
  "format": "pythagoras.question-package",
  "schemaVersion": "1.0.0",
  "contentMode": "question-bank",
  "package": { "id": "01910000-0000-7000-8000-000000000060", "key": "asset-reference", "title": "مرجع أصل اصطناعي", "subjectKey": "biology", "language": "ar-IQ", "contentRevision": 1 },
  "taxonomy": [{ "id": "01910000-0000-7000-8000-000000000061", "key": "topic", "label": "موضوع", "kind": "topic", "parentId": null, "order": 1 }],
  "bankBrowse": { "mode": "ALL_PACKAGE_QUESTIONS", "entry": { "key": "all", "label": "الكل", "order": 1 }, "nodes": [] },
  "assetsManifest": [{ "ref": "diagram-one", "sha256": "aaaaaaaaaaaaaaaaaaaaaaaaaaaaaaaaaaaaaaaaaaaaaaaaaaaaaaaaaaaaaaaa", "filename": "رسم-اصطناعي.png", "mimeType": "image/png", "byteSize": 128 }],
  "questions": [{
    "id": "01910000-0000-7000-8000-000000000062", "order": 1,
    "primaryVariantId": "01910000-0000-7000-8000-000000000063",
    "taxonomyAssignments": [{ "taxonomyNodeId": "01910000-0000-7000-8000-000000000061", "role": "PRIMARY" }],
    "variants": [{ "id": "01910000-0000-7000-8000-000000000063", "order": 1, "content": { "type": "doc", "version": 1, "blocks": [{ "type": "image", "assetRef": "diagram-one", "alt": "رسم توضيحي اصطناعي" }] }, "occurrences": [] }],
    "sharedAnswer": { "type": "doc", "version": 1, "blocks": [{ "type": "paragraph", "spans": [{ "text": "إجابة" }] }] }
  }]
}
